{
  "$schema": "http://json-schema.org/draft-07/schema#",
  "title": "Card",
  "type": "object",
  "required": ["name", "slug"],
  "properties": {
    "name": { "type": "string" },
    "slug": { "type": "string", "pattern": "^[\\w-]+$" },
    "info": { "type": ["array", "object", "string" ] },
    "sections": {
      "type": "array",
      "items": {
        "type": "object",
        "properties": {
          "subtitle": { "type": ["string", "null"] },
          "paragraphs": { "type": "array", "items": { "type": "string" } }
        }
      }
    },
    "tags": { "type": "array", "items": { "type": "string" } },
    "meta": {
      "type": "object",
      "properties": {
        "source": { "type": "string" },
        "last_modified": { "type": "string" }
      }
    }
  },
  "additionalProperties": true
}
