{
  "name": "LE NECTAR",
  "slug": "le_nectar",
  "info": [
    "Symbolise la douceur offerte et l’élixir de vie. Le nectar précieux au cœur de la fleur représente la récompense pour celui qui cherche, l’essence concentrée et l’alchimie végétale. Cette carte parle de ce qui nourrit subtilement, de l’échange sacré et de la richesse cachée."
  ],
  "sections": [
    {
      "subtitle": "Description étendue :",
      "paragraphs": [
        "L’essence du don et la douceur réalisée.",
        "Le Nectar est le fruit sublimé, la douceur recueillie après le labeur du vivant.",
        "C’est la carte de la récompense intérieure, du plaisir partagé, de la communion avec la beauté de l’existence.",
        "Dans le tarot, elle représente la distillation spirituelle : l’expérience devenue sagesse, l’amour devenu essence.",
        "Elle parle de gratitude, de joie pure, d’union des contraires.",
        "Elle enseigne que la douceur n’est pas naïveté, mais aboutissement de la transformation, la paix après l’effort, la lumière après la germination."
      ]
    },
    {
      "subtitle": "Mots-clés lumière :",
      "paragraphs": [
        "Joie, douceur, alchimie, union, gratitude, essence, élévation, sérénité, plaisir du vivant."
      ]
    },
    {
      "subtitle": "Ombre :",
      "paragraphs": [
        "L’attachement au plaisir ou à la récompense.",
        "Sous son ombre, Le Nectar devient dépendance : la recherche de douceur devient fuite du réel.",
        "On s’attache au confort, on se perd dans le plaisir sans profondeur.",
        "C’est la carte de l’illusion d'être “arrivé”, de la complaisance spirituelle, du refus de redescendre vers la terre.",
        "Elle invite à savourer sans s’y noyer, à comprendre que même la lumière doit circuler."
      ]
    },
    {
      "subtitle": "Mots-clés ombre :",
      "paragraphs": [
        "Complaisance, fuite, attachement, mollesse, perte d’élan, stagnation, quête du confort, excès de douceur."
      ]
    },
    {
      "subtitle": "Chemins d’intégration :",
      "paragraphs": [
        "Savourer sans s’attacher : goûter la vie dans l’instant.",
        "Honorer la douceur comme une sagesse, non une fuite.",
        "Laisser circuler la joie reçue en l’offrant à nouveau.",
        "Intégrer la paix plutôt que la posséder.",
        "Dans un tirage, Le Nectar évoque la satisfaction intérieure, la guérison du cœur, l’accomplissement lumineux d’un cycle, mais aussi la vigilance face à la complaisance."
      ]
    },
    {
      "subtitle": "Exercice / Méditation :",
      "paragraphs": [
        "Assieds-toi calmement.",
        "Imagine une goutte de miel suspendue au centre de ta poitrine.",
        "À chaque souffle, elle s’illumine davantage, se répand dans ton corps.",
        "Laisse sa douceur nourrir tes cellules puis imagine cette lumière rayonner vers le monde.",
        "Le Nectar est la lumière devenue saveur, la substance du bonheur tranquille.",
        "Elle incarne la dernière étape du cycle végétal : la transmutation de la matière en joie, de la croissance en sagesse.",
        "Dans le grand cycle du Tarot Fleur d’ÅmÔurs, elle représente l’accomplissement du vivant dans sa forme la plus fine, le moment où la terre goûte le ciel et s’y reconnaît.",
        "Le Nectar enseigne que le véritable plaisir est un état d’union : il ne s’oppose à rien, il réconcilie tout."
      ]
    },
    {
      "subtitle": "Correspondances énergétiques :",
      "paragraphs": [],
      "correspondances": {
        "Élément": "Eau et Éther",
        "Polarité": "Féminine subtile (réceptive, alchimique, unificatrice)",
        "Correspondances symboliques": "Douceur, Quintessence, Transformation lumineuse",
        "En résonance": "Eau (La Brume), Feu (Le Cœur du Feu), Vie (L’Unité)"
      }
    },
    {
      "subtitle": "Question Racine :",
      "paragraphs": [
        "«Où se cache la douceur et le plaisir dans ce que je vis en ce moment ?»"
      ]
    }
  ]
}