{
  "name": "LE POLLEN",
  "slug": "le_pollen",
  "info": [
    "Symbolise la transmission et la fécondation. Les grains de pollen portés par le vent ou les pollinisateurs représentent le message génétique voyageur, la chance fertile et l’union à distance. Cette carte parle de dissémination d’idées, de rencontres providentielles et de créativité collaborative."
  ],
  "sections": [
    {
      "subtitle": "Description étendue :",
      "paragraphs": [
        "La diffusion de la vie et du souffle créateur",
        "Le Pollen est le voyageur du vivant, le souffle qui transporte la promesse de la fécondité.",
        "C’est la carte du mouvement, du partage, de la propagation des idées et des graines.",
        "Dans le tarot, elle symbolise la communication vibratoire : ce qui, de soi, touche le monde sans qu’on le voie.",
        "Elle enseigne la confiance dans la circulation invisible, la générosité du geste qui sème sans attendre de retour.",
        "Le Pollen rappelle que chaque parole, chaque acte, chaque souffle peut devenir fécond."
      ]
    },
    {
      "subtitle": "Mots-clés lumière :",
      "paragraphs": [
        "Diffusion, partage, transmission, circulation, inspiration, fécondité, légèreté,",
        "souffle créateur, interconnexion."
      ]
    },
    {
      "subtitle": "Ombre :",
      "paragraphs": [
        "La dispersion et la perte de substance. Sous son ombre, Le Pollen devient éparpillement.",
        "L’énergie se disperse, les intentions se dissolvent dans le vent.",
        "C’est la carte de la parole sans racine, de la créativité qui s’éparpille, ou des projets qui manquent d’ancrage.",
        "À l’excès, elle évoque aussi la contamination l’idée imposée, le message diffusé sans conscience.",
        "Le Pollen rappelle que le vent porte tout, mais que tout vent doit connaître son origine."
      ]
    },
    {
      "subtitle": "Mots-clés ombre :",
      "paragraphs": [
        "Distraction, dispersion, insouciance, superficialité, influence, perte de direction, paroles vides."
      ]
    },
    {
      "subtitle": "Chemins d’intégration :",
      "paragraphs": [
        "Semez sans attachement au résultat.",
        "Cultivez la légèreté consciente : laisser aller ce qui doit circuler.",
        "Parlez avec clarté, agissez avec intention.",
        "Faites confiance aux courants invisibles qui relient les êtres.",
        "Dans un tirage, Le Pollen évoque une période d’expansion, de communication, de transmission d’idées ou d’énergie, mais invite à ne pas se disperser."
      ]
    },
    {
      "subtitle": "Exercice / Méditation :",
      "paragraphs": [
        "Sors dehors un jour de vent. Respire profondément.",
        "Imagine que ton souffle devient pollen d’or, léger, lumineux, porteur d’inspiration.",
        "Laisse le vent l’emporter confiant qu’il saura trouver terre fertile.",
        "Le Pollen est le souffle du partage, l’amour qui se déplace par la grâce du vent.",
        "Il enseigne que toute création doit circuler pour rester vivante.",
        "Dans le grand cycle du Tarot Fleur d’ÅmÔurs, il représente la transmission et la dissémination des forces fertiles, le passage de la création individuelle à la fécondité collective.",
        "Le Pollen rappelle que le vivant ne garde rien pour lui : il se propage, il relie, il féconde par sa seule présence."
      ]
    },
    {
      "subtitle": "Correspondances énergétiques :",
      "paragraphs": [],
      "correspondances": {
        "Élément": "Air et Feu",
        "Polarité": "Masculine diffuse (active, volatile, fécondante)",
        "Correspondances symboliques": "Transmission, Voyage, Esprit du vent",
        "En résonance": "Air (L’Alizé), Vie (L’Abeille), Feu (Le Vent Solaire)"
      }
    },
    {
      "subtitle": "Question Racine :",
      "paragraphs": [
        "«Quelle idée ou quel message ai-je besoin de disséminer autour de moi ?»"
      ]
    }
  ]
}