{
  "name": "LE SILENCE ÉTOILÉ",
  "slug": "le_silence_etoile",
  "info": [
    "Incarne la vastitude et la contemplation cosmique. L’immensité nocturne parsemée d’étoiles, avec la galaxie spirale au centre, elle représente l’espace sacré du silence intérieur et symbolise la méditation profonde, la connexion au cosmos et la paix qui naît dans le vide fécond."
  ],
  "sections": [
    {
      "subtitle": "Description étendue :",
      "paragraphs": [
        "Le repos de la création et la paix totale.",
        "Le Silence Étoilé est la respiration suspendue de l’univers.",
        "C’est la carte de la paix absolue, de la contemplation, du retour au cœur du mystère.",
        "Elle évoque la présence pure sans mot, sans mouvement, mais infiniment vivante.",
        "Dans le tarot, elle représente l’état de conscience qui précède et succède à toute création : l’instant où l’être se fond dans le cosmos sans s’y perdre.",
        "Elle enseigne que le silence n’est pas absence, mais plénitude. Le Silence Étoilé, c’est la lumière qui a cessé de vouloir briller."
      ]
    },
    {
      "subtitle": "Mots-clés lumière :",
      "paragraphs": [
        "Paix, repos, sagesse, contemplation, silence intérieur, union cosmique, présence pure, plénitude, lumière tranquille."
      ]
    },
    {
      "subtitle": "Ombre :",
      "paragraphs": [
        "Le vide, la fuite ou la déconnexion du monde",
        "Sous son ombre, Le Silence Étoilé devient mutisme, inertie ou détachement froid.",
        "C’est la carte du retrait excessif, de la perte d’incarnation, ou de la solitude spirituelle.",
        "Trop de distance coupe le lien avec le vivant.",
        "Elle avertit, le silence véritable ne fuit pas le monde il l’embrasse.",
        "Il ne s’agit pas de se taire, mais d’écouter autrement."
      ]
    },
    {
      "subtitle": "Mots-clés ombre :",
      "paragraphs": [
        "Isolement, indifférence, fuite du réel, apathie, silence stérile, oubli du corps, détachement froid."
      ]
    },
    {
      "subtitle": "Chemins d’intégration :",
      "paragraphs": [
        "Se relier au silence comme espace vibrant, non comme absence.",
        "Trouver la paix sans s’exclure du vivant.",
        "Écouter les étoiles intérieures : cette clarté tranquille qui ne juge pas.",
        "Laisser la parole, l’action, le souffle se déposer dans la conscience.",
        "Dans un tirage, Le Silence Étoilé annonce un aboutissement, une paix retrouvée, ou une période de grande contemplation.",
        "Il peut marquer le repos après un cycle intense, l’intégration d’une révélation, ou le sentiment d’unité totale."
      ]
    },
    {
      "subtitle": "Exercice / Méditation :",
      "paragraphs": [
        "Ferme les yeux.",
        "Imagine le ciel nocturne vaste, profond, immobile.",
        "Chaque étoile pulse doucement, comme un cœur qui respire dans le silence.",
        "Ressens-toi au centre de ce cosmos, calme, lumineux, sans besoin de rien.",
        "Ici, tout est parfait.",
        "Le Silence Étoilé est le cœur immobile du cosmos, la paix après la danse, la présence après la parole.",
        "Il enseigne que tout mouvement a besoin d’un centre, et que ce centre est silence.",
        "Dans le grand Tarot Fleur d’ÅmÔurs, il représente la conclusion et la source, la conscience pure d’où naît le chant du monde.",
        "Il nous rappelle que la beauté ultime ne fait pas de bruit : elle scintille dans l’éternité du souffle."
      ]
    },
    {
      "subtitle": "Correspondances énergétiques :",
      "paragraphs": [],
      "correspondances": {
        "Élément": "Éther",
        "Polarité": "Absolue et apaisée (ni active ni passive, présence pure)",
        "Correspondances symboliques": "Repos cosmique, Contemplation, Source éternelle du verbe",
        "En résonance": "Terre (La Roche-Mère), Eau (L’Océan), Air (Le Messager), Feu (Le Volcan), Vie (L’Âme du Monde)"
      }
    },
    {
      "subtitle": "Question Racine :",
      "paragraphs": [
        "«Si je m’arrête de parler et de faire, que reste-t-il ?»"
      ]
    }
  ]
}