{
  "name": "LE FEU",
  "slug": "le_feu",
  "info": [
    "Représente la transformation et l’énergie vitale. Symbolise la passion, l’action, le courage et la volonté créatrice. Cette carte incarne la force qui consume et renouvelle, la lumière de la conscience et le pouvoir de changer radicalement."
  ],
  "sections": [
    {
      "subtitle": "Description étendue :",
      "paragraphs": [
        "L’étincelle divine et la puissance créatrice. Le Feu est l’esprit en mouvement.",
        "C’est la force qui anime, éclaire, transforme et inspire.",
        "Dans le tarot, il symbolise la passion, la clarté, la créativité et le pouvoir transmutateur de l’amour conscient.",
        "C’est la flamme du cœur, le moteur de la vision, le courage d’oser.",
        "Il enseigne que Le Feu est sacré lorsqu’il éclaire sans détruire, qu’il réchauffe sans dominer.",
        "Le Feu, c’est le souffle du ciel tombé dans la matière."
      ]
    },
    {
      "subtitle": "Mots-clés lumière :",
      "paragraphs": [
        "Inspiration, vitalité, clarté, transformation, illumination, courage, créativité, purification, présence, amour actif."
      ]
    },
    {
      "subtitle": "Ombre :",
      "paragraphs": [
        "L’incendie ou la perte de maîtrise. Sous son ombre, Le Feu devient dévorant.",
        "C’est la carte de la colère, du pouvoir incontrôlé, de la destruction ou du désir qui consume.",
        "Elle évoque aussi la lassitude intérieure, le feu éteint par le doute ou l’oubli de soi.",
        "Le Feu avertit, sans souffle pour le nourrir, il s’éteint ; sans conscience pour le guider, il brûle.",
        "Trouver le juste feu, c’est apprendre à aimer avec discernement."
      ]
    },
    {
      "subtitle": "Mots-clés ombre :",
      "paragraphs": [
        "Colère, excès, domination, épuisement, orgueil, destruction, frustration, perte de sens."
      ]
    },
    {
      "subtitle": "Chemins d’intégration :",
      "paragraphs": [
        "Canaliser le feu intérieur dans la création, non la réaction.",
        "Nourrir sa flamme par la respiration, la joie, la présence.",
        "Apprendre à reconnaître quand le feu devient lutte.",
        "Allumer la lumière intérieure pour éclairer, non pour briller.",
        "Dans un tirage, Le Feu annonce une période d’énergie, de passion ou de transformation, un élan puissant de créativité ou une révélation spirituelle."
      ]
    },
    {
      "subtitle": "Exercice / Méditation :",
      "paragraphs": [
        "Allume une bougie.",
        "Observe la flamme danser : son centre bleu, son halo doré, sa chaleur. Ressens qu’elle respire comme toi.",
        "À chaque inspiration, laisse la flamme entrer dans ton cœur ; à chaque expiration,",
        "laisse-la rayonner autour de toi.",
        "Tu es feu conscient.",
        "Le Feu est la volonté de vivre, la conscience qui s’allume.",
        "Il enseigne la puissance de la transformation et la joie d’agir depuis le cœur.",
        "Dans le grand Tarot Fleur d’ÅmÔurs, il représente l’énergie créatrice universelle,",
        "le moteur du mouvement et de la métamorphose.",
        "Il rappelle que chaque être porte une flamme intérieure : une part du soleil confiée à la chair.",
        "L’entretenir, c’est honorer la vie."
      ]
    },
    {
      "subtitle": "Correspondances énergétiques :",
      "paragraphs": [],
      "correspondances": {
        "Élément": "Feu pur",
        "Polarité": "Masculine active (créatrice, expansive, visionnaire)",
        "Correspondances symboliques": "Énergie vitale, Transformation, Volonté, Lumière intérieure",
        "En résonance": "Feu (Le Cœur du Feu, Le Volcan), Éther (La Source Lumineuse)"
      }
    },
    {
      "subtitle": "Question Racine :",
      "paragraphs": [
        "«Quelle est l’action courageuse que je repousse et qui débloquerait tout ?»"
      ]
    }
  ]
}