{
  "name": "LE CŒUR du feu",
  "slug": "le_cœur_du_feu",
  "info": [
    "Incarne la passion et le courage ardent. Le cœur enflammé enraciné dans la terre symbolise l’amour vivant, la dévotion brûlante et la force vitale qui anime l’existence. Représente l’engagement total, le feu sacré de la vocation et la capacité à aimer intensément malgré tout."
  ],
  "sections": [
    {
      "subtitle": "Description étendue :",
      "paragraphs": [
        "La puissance consciente et le feu créateur. Le Cœur du Feu est l’étincelle divine dans la matière.",
        "C’est la flamme qui transforme, le foyer où le désir devient lumière.",
        "Dans le tarot, il incarne la passion maîtrisée, l’énergie vitale mise au service de la création, la ferveur qui inspire sans consumer.",
        "Il enseigne la chaleur du cœur, la clarté du centre, le courage d’agir depuis l’âme.",
        "C’est la force du feu sacré, celui qui éclaire le monde sans le brûler."
      ]
    },
    {
      "subtitle": "Mots-clés lumière :",
      "paragraphs": [
        "Énergie vitale, passion, transformation, amour ardent, conscience claire, courage, pouvoir créatif, rayonnement intérieur."
      ]
    },
    {
      "subtitle": "Ombre :",
      "paragraphs": [
        "Le feu qui dévore ou s’éteint",
        "Sous son ombre, le Cœur du Feu devient brasier ou cendre :",
        "trop intense, il consume tout ; trop faible, il s’éteint par négligence.",
        "C’est la carte du déséquilibre des forces, du burnout, de la colère, ou de la perte d’enthousiasme.",
        "Elle avertit, l’énergie est un feu sacré à entretenir avec respect. Brûler sans but ou refuser de brûler, c’est oublier sa nature solaire."
      ]
    },
    {
      "subtitle": "Mots-clés ombre :",
      "paragraphs": [
        "Colère, épuisement, excès de contrôle, perte de désir, frustration, dispersion, feu destructeur."
      ]
    },
    {
      "subtitle": "Chemins d’intégration :",
      "paragraphs": [
        "Canaliser la passion dans la conscience.",
        "Apprendre à nourrir la flamme sans la forcer.",
        "Transformer les émotions en force créative.",
        "Se relier à la joie d’agir depuis le cœur.",
        "Dans un tirage, Le Cœur du Feu indique un moment de grande énergie, de transformation intérieure ou d’élan créatif intense, mais appelle à la vigilance dans la gestion de cette puissance."
      ]
    },
    {
      "subtitle": "Exercice / Méditation :",
      "paragraphs": [
        "Assieds-toi en silence.",
        "Porte ton attention au centre de ta poitrine. Imagine une flamme dorée, stable et douce.",
        "À chaque inspiration, elle s’intensifie ; à chaque expiration, elle rayonne. Sens sa chaleur emplir ton être sans t’envahir.",
        "Le Cœur du Feu est la forge du vivant, le centre incandescent où la matière se spiritualise.",
        "Il enseigne que l’amour véritable est un feu conscient : il transforme sans dominer, il éclaire sans consommer.",
        "Dans le grand Tarot Fleur d’ÅmÔurs, il représente l’intelligence du feu, la force qui anime le monde et révèle la vérité du cœur.",
        "Il nous rappelle que toute lumière est née d’une combustion mais que la flamme du cœur, elle, ne s’éteint jamais."
      ]
    },
    {
      "subtitle": "Correspondances énergétiques :",
      "paragraphs": [],
      "correspondances": {
        "Élément": "Feu",
        "Polarité": "Masculine rayonnante (créatrice, expansive, consciente)",
        "Correspondances symboliques": "Transformation, Vitalité, Flamme de l’âme",
        "En résonance": "Terre (Le Cristal), Végetal (Le Nectar), Vie (L’Âme du Monde)"
      }
    },
    {
      "subtitle": "Question Racine :",
      "paragraphs": [
        "«Qu’est-ce qui me fait sentir intensément vivant·e quand je le fais ?»"
      ]
    }
  ]
}