{
  "name": "LE MANDALA COSMIQUE",
  "slug": "le_mandala_cosmique",
  "info": [
    "Incarne la perfection géométrique de la création. La fleur de vie entourée de végétation et d’étoiles représente le plan divin, la matrice sacrée qui sous-tend toute manifestation. Cette carte évoque l’ordre cosmique, la beauté mathématique de l’univers et la contemplation de l’architecture divine."
  ],
  "sections": [
    {
      "subtitle": "Description étendue :",
      "paragraphs": [
        "Le dessin sacré du monde.",
        "Le Mandala Cosmique est la carte de l’ordre secret du monde.",
        "Il représente la danse harmonieuse des planètes, des atomes, des consciences : chaque chose a sa place, reliée à toutes les autres par des lignes de lumière.",
        "Dans le tarot, il symbolise la perfection en mouvement, la conscience géométrique, la beauté fractale de l’univers.",
        "C’est la carte de la vision claire, de la reliance multidimensionnelle, du regard qui voit à la fois le tout et la partie.",
        "Le Mandala Cosmique révèle la musique silencieuse de la création."
      ]
    },
    {
      "subtitle": "Mots-clés lumière :",
      "paragraphs": [
        "Unité, interconnexion, équilibre, vision, expansion de conscience, géométrie sacrée, harmonie, ordre divin, lien cosmique."
      ]
    },
    {
      "subtitle": "Ombre :",
      "paragraphs": [
        "La perte dans la complexité ou la rigidité spirituelle. Sous son ombre, le Mandala devient labyrinthe.",
        "C’est la carte du mental spirituel, de la fascination pour les systèmes, de la quête d’ordre au détriment du vivant.",
        "Elle avertit contre la rigidité, la perte de spontanéité dans la contemplation de la perfection.",
        "Le cosmos n’est pas une machine, c’est un organisme vivant.",
        "Trop vouloir comprendre le dessin, c’est oublier la main qui le trace."
      ]
    },
    {
      "subtitle": "Mots-clés ombre :",
      "paragraphs": [
        "Fixation, excès d’analyse, perfectionnisme spirituel, rigidité mentale, perte d’intuition, confusion mystique, isolement conceptuel."
      ]
    },
    {
      "subtitle": "Chemins d’intégration :",
      "paragraphs": [
        "Contempler le monde sans chercher à le réduire.",
        "Voir les motifs cachés dans la vie quotidienne : les synchronicités, les cycles, les correspondances.",
        "Se sentir à la fois centre et cercle, acteur et témoin.",
        "Honorer la beauté de l’ordre naturel sans vouloir le posséder.",
        "Dans un tirage, Le Mandala Cosmique indique une période de clarté, de compréhension globale, d’expansion de conscience mais aussi le besoin de revenir au cœur quand la complexité devient vertige."
      ]
    },
    {
      "subtitle": "Exercice / Méditation :",
      "paragraphs": [
        "Ferme les yeux et imagine un grand mandala de lumière tournant lentement autour de ton cœur.",
        "À chaque respiration, il s’agrandit, reliant tes cellules aux galaxies.",
        "Observe comment chaque point, chaque forme, chaque couleur émane de ton centre.",
        "Tu es à la fois le dessin et le regard.",
        "Le Mandala Cosmique est le visage ordonné de l’infini.",
        "Il enseigne que la beauté du monde ne réside pas dans la perfection, mais dans la cohérence du mouvement.",
        "Dans le grand Tarot Fleur d’ÅmÔurs, il représente la conscience de la structure sacrée de l’univers, la géométrie de l’âme qui relie toutes choses dans une même pulsation.",
        "Il rappelle que la création n’est pas un hasard : c’est une danse précise et aimante du chaos et de la clarté.",
        "Chaque existence est une ligne du dessin éternel."
      ]
    },
    {
      "subtitle": "Correspondances énergétiques :",
      "paragraphs": [],
      "correspondances": {
        "Élément": "Éther",
        "Polarité": "Équilibrée (union du masculin et du féminin, du centre et de la périphérie)",
        "Correspondances symboliques": "Ordre universel, Interconnexion, Géométrie du vivant",
        "En résonance": "Feu (Le Soleil Intérieur), Air (L’Alizé), Ether (L’Harmonie des Cycles)"
      }
    },
    {
      "subtitle": "Question Racine :",
      "paragraphs": [
        "«Quel est le sens caché ou l’ordre derrière le chaos apparent de ma situation ?»"
      ]
    }
  ]
}