{
  "name": "L’ABEILLE",
  "slug": "l_abeille",
  "info": [
    "Incarne l’alchimie subtile et le service sacré. Messagère entre les mondes, elle symbolise la pollinisation des idées, le travail communautaire et la transformation du nectar en or. Représente l’intelligence collective et la danse entre l’individu et le tout."
  ],
  "sections": [
    {
      "subtitle": "Description étendue :",
      "paragraphs": [
        "L’alchimiste du vivant et la gardienne de l’harmonie. L’Abeille est la prêtresse du monde en mouvement.",
        "Elle relie les fleurs, féconde la terre, produit le miel essence de la collaboration.",
        "Dans le tarot, elle symbolise l’intelligence collective, la justesse du rôle, la beauté du service partagé.",
        "C’est la carte de la coopération consciente, du lien entre effort individuel et harmonie globale.",
        "Elle enseigne que le bonheur est dans la contribution, et que chaque geste accompli avec amour devient offrande.",
        "L’Abeille, c’est l’art d’agir pour le tout."
      ]
    },
    {
      "subtitle": "Mots-clés lumière :",
      "paragraphs": [
        "Travail collectif, harmonie, service, dévouement, alchimie, douceur, fertilité, équilibre, union dans la diversité."
      ]
    },
    {
      "subtitle": "Ombre :",
      "paragraphs": [
        "L’épuisement ou la perte du sens dans le faire.",
        "Sous son ombre, L’Abeille s’épuise dans l’activité.",
        "C’est la carte de l’agitation vide, du devoir sans joie, ou du sacrifice pour le groupe au détriment de soi.",
        "Elle met en garde contre la perte du centre intérieur dans le travail collectif.",
        "Sans nectar intérieur, le miel perd son goût."
      ]
    },
    {
      "subtitle": "Mots-clés ombre :",
      "paragraphs": [
        "Surmenage, perfectionnisme, oubli de soi, dévotion aveugle, dépendance au groupe, épuisement, routine."
      ]
    },
    {
      "subtitle": "Chemins d’intégration :",
      "paragraphs": [
        "Agir pour le monde sans s’oublier dans le service.",
        "Redécouvrir la joie du travail collectif.",
        "Trouver sa place juste dans le grand essaim du vivant.",
        "Créer ensemble, mais à partir du cœur.",
        "Dans un tirage, L’Abeille annonce une coopération fructueuse, un projet collectif, ou une phase d’activité alignée, où chacun trouve naturellement sa fonction."
      ]
    },
    {
      "subtitle": "Exercice / Méditation :",
      "paragraphs": [
        "Assieds-toi et écoute le bourdonnement du silence. Imagine une ruche dorée à l’intérieur de ta poitrine.",
        "Des milliers de petites abeilles y œuvrent en paix, chacune à sa place. Ressens la vibration commune : c’est le son du monde qui travaille en toi. L’Abeille est le cœur battant de la Vie.",
        "Elle nous rappelle que chaque être participe à la grande symphonie du monde.",
        "Dans le grand Tarot Fleur d’ÅmÔurs, elle représente la force du lien, l’alchimie de la coopération, la joie du service conscient.",
        "Elle enseigne que le bonheur n’est pas solitaire : il est collectif, résonant, vibrant.",
        "Le miel qu’elle crée est la mémoire dorée de la lumière partagée."
      ]
    },
    {
      "subtitle": "Résonance de l’Âme :",
      "paragraphs": [
        "L’Abeille est un puissant symbole d’alchimie relationnelle et de coopération sacrée. Sa résonance d’âme invite à sortir de l’isolement et à participer activement au «butin» collectif. Il s’agit d’agir comme un vecteur de pollinisation, de cultiver des relations fécondes et de laisser circuler le nectar de votre être, plutôt que de rester dans des interactions superficielles et utilitaires. Elle peut aussi signaler un besoin de reconnexion avec la vibration du groupe."
      ]
    },
    {
      "subtitle": "Correspondances énergétiques :",
      "paragraphs": [],
      "correspondances": {
        "Élément": "Air et Terre",
        "Polarité": "Féminine communautaire (travailleuse, messagère, harmonisatrice)",
        "Correspondances symboliques": "Coopération, Alchimie, Intelligence collective",
        "En résonance": "Feu (La Braise), Terre (L’Humus), Eau (L’Estuaire)"
      }
    },
    {
      "subtitle": "Question Racine :",
      "paragraphs": [
        "«Quelle est ma contribution unique au groupe ou à la communauté ?»"
      ]
    }
  ]
}