{
  "name": "LA BRAISE",
  "slug": "la_braise",
  "info": [
    "Symbolise la chaleur latente et le potentiel endormi. La braise rougeoyante sous la cendre représente l’énergie préservée, la force qui attend son moment. Cette carte parle de patience active, de ressources intérieures maintenues vivantes et de la capacité à raviver le feu quand le temps est venu."
  ],
  "sections": [
    {
      "subtitle": "Description étendue :",
      "paragraphs": [
        "Le feu intérieur, la chaleur qui veille. La Braise est le souvenir du feu vivant.",
        "Elle symbolise la constance, la douceur de la force tranquille, la chaleur du cœur qui ne s’éteint jamais vraiment.",
        "Dans le tarot, elle invite à reconnaître la présence du feu même dans les apparences de calme.",
        "Elle représente l’énergie vitale en veille, la patience du feu sage, le potentiel créatif prêt à renaître.",
        "Elle enseigne la confiance dans la flamme intérieure : ce qui semble endormi prépare sa renaissance."
      ]
    },
    {
      "subtitle": "Mots-clés lumière :",
      "paragraphs": [
        "Force tranquille, vitalité, patience, chaleur du cœur, endurance, confiance, feu intérieur, transformation douce."
      ]
    },
    {
      "subtitle": "Ombre :",
      "paragraphs": [
        "La torpeur ou la perte de souffle.",
        "Sous sont ombre, la Braise devient cendres froides.",
        "C’est la carte de l’épuisement, de la résignation ou du manque de désir. La flamme intérieure s’y éteint peu à peu, faute de souffle ou d’attention.",
        "Elle avertit, ignorer sa propre passion, c’est laisser le feu mourir en silence.",
        "Mais elle rappelle aussi qu’il suffit d’un souffle pour le rallumer."
      ]
    },
    {
      "subtitle": "Mots-clés ombre :",
      "paragraphs": [
        "Fatigue, découragement, désenchantement, inertie, oubli de soi, perte de motivation, feu éteint."
      ]
    },
    {
      "subtitle": "Chemins d’intégration :",
      "paragraphs": [
        "Honorer les temps de repos sans perdre la vigilance du feu.",
        "Ranimer la flamme en soi par la respiration et la joie.",
        "Garder la foi en sa lumière même lorsqu’elle se fait discrète.",
        "Apprendre la puissance du calme et de la lente combustion.",
        "Dans un tirage, La Braise indique une force intérieure prête à renaître, un potentiel créatif latent ou une chaleur affective stable et durable."
      ]
    },
    {
      "subtitle": "Exercice / Méditation :",
      "paragraphs": [
        "Ferme les yeux et visualise une braise rougeoyante dans ton ventre. À chaque inspiration, elle se ravive.",
        "À chaque expiration, elle chauffe ton cœur sans brûler. Sens cette lumière stable, tranquille, fidèle. La Braise est le feu du cœur qui se souvient.",
        "Elle enseigne que la puissance n’a pas besoin d’éclat pour exister.",
        "Dans le grand Tarot Fleur d’ÅmÔurs, elle représente la présence silencieuse de la flamme vitale, la patience du feu sage qui connaît le rythme du temps.",
        "Elle rappelle que la passion véritable ne se consume pas : elle mûrit.",
        "Sous la cendre, la vie respire encore."
      ]
    },
    {
      "subtitle": "Correspondances énergétiques :",
      "paragraphs": [],
      "correspondances": {
        "Élément": "Feu et Terre",
        "Polarité": "Féminine contenue (intérieure, silencieuse, nourricière du feu)",
        "Correspondances symboliques": "Chaleur, Endurance, Feu latent du cœur",
        "En résonance": "Terre (La Cendre Fertile), Eau (La Vague), Vie (L’Abeille)"
      }
    },
    {
      "subtitle": "Question Racine :",
      "paragraphs": [
        "«Quel projet ou désir ai-je laissé de côté mais qui est encore chaud en moi ?»"
      ]
    }
  ]
}