{
  "name": "LA PRESENCE",
  "slug": "la_presence",
  "info": [
    "La Présence est le point fixe au centre du tourbillon. Elle ne fait rien, elle ne cherche rien, elle est. Elle représente la conscience éveillée dans la matière, la clarté du regard qui ne fuit plus, la paix qui ne dépend de rien."
  ],
  "sections": [
    {
      "subtitle": "Description étendue :",
      "paragraphs": [
        "Être présent, c’est cesser de courir vers demain, c’est descendre en soi comme on revient à la maison.",
        "Dans le grand théâtre du monde, la Présence est l’acte silencieux qui donne sens à tout le reste.",
        "Elle nous enseigne que le divin n’est pas ailleurs : il se trouve dans le souffle, dans la marche, dans le geste le plus simple lorsqu’il est habité de conscience.",
        "La Présence est une offrande de stabilité au cœur du chaos.",
        "Elle invite à habiter pleinement son corps, à respirer la vie telle qu’elle est, à devenir espace plutôt qu’agitation.",
        "Dans ce calme, tout se révèle : la beauté, la vérité, la joie nue d’exister.",
        "c'est la sérénité, le centrage, la clarté intérieure.",
        "La capacité à écouter sans interpréter, à agir sans s’identifier.",
        "L'union du souffle et du silence."
      ]
    },
    {
      "subtitle": "Mots-clés lumière :",
      "paragraphs": [
        "Ancrage, Clarté, Silence, Simplicité, Éveil, Lucidité, Paix incarnée."
      ]
    },
    {
      "subtitle": "Ombre :",
      "paragraphs": [
        "Agitation mentale, distraction permanente, fuite dans l’action ou la pensée.",
        "Refus du silence, peur du vide, désincarnation spirituelle."
      ]
    },
    {
      "subtitle": "Mots-clés ombre :",
      "paragraphs": [
        "Fuite, Distraction, Tension, Absence, Surstimulation, Déconnexion du corps."
      ]
    },
    {
      "subtitle": "Chemin d’intégration :",
      "paragraphs": [
        "Reviens au souffle.",
        "Observe sans intervenir.",
        "Laisse la conscience descendre du mental au cœur, puis du cœur au ventre.",
        "C’est là que se trouve la paix, non dans le monde, mais dans la façon dont tu l’habites. Être présent, c’est choisir d’aimer la réalité telle qu’elle se présente."
      ]
    },
    {
      "subtitle": "Exercice / méditation :",
      "paragraphs": [
        "Assieds-toi dans le calme.",
        "Ferme les yeux.",
        "Sens ton corps posé, ton souffle naturel, ta peau qui respire.",
        "À chaque inspiration, dis intérieurement : « Je reçois. »",
        "À chaque expiration : « Je me donne. »",
        "Laisse ce rythme s’approfondir jusqu’à sentir que tu n’es plus celui qui respire, mais la respiration elle-même.",
        "Quand le mental revient, souris-lui.",
        "La Présence, c’est cela : ne rien forcer, simplement être là."
      ]
    },
    {
      "subtitle": "Résonance de l’Âme :",
      "paragraphs": [
        "La Présence est l’état d’Éveil non-duel. Elle représente l’accès direct à l’énergie de l’Agapè. Dans une lecture d’âme, elle est le but ultime de la pratique : une invitation à débrancher les circuits de la mémoire (passé) et de l’anticipation (futur) pour incarner l’ici et maintenant, source de toute guérison et vérité."
      ]
    },
    {
      "subtitle": "Correspondances énergétiques :",
      "paragraphs": [],
      "correspondances": {
        "Éléments": "Éther / Air, la conscience et le souffle",
        "Polarité": "Féminine (calme, réceptive, contemplative)",
        "En résonance": "Air (Le Vent Solaire), Vie (Le Silence Étoilé), Fleur d’ÅmÔurs (Philautia)"
      }
    },
    {
      "subtitle": "Question Racine :",
      "paragraphs": [
        "«Suis-je vraiment là, ou suis-je déjà en train de planifier la suite ?»"
      ]
    }
  ]
}