{
  "name": "ÉROS",
  "slug": "eros",
  "info": [
    "Représente l’amour passionnel et le désir ardent. C’est l’attraction physique, la passion romantique et l’union des corps. Cette carte symbolise l’intensité du désir, l’ivresse amoureuse et la fusion érotique."
  ],
  "sections": [
    {
      "subtitle": "Description étendue :",
      "paragraphs": [
        "L’élan vital et la création consciente",
        "Éros est la pulsion d’amour incarnée, le mouvement du désir qui pousse la vie à se multiplier, à s’unir, à créer.",
        "C’est l’étincelle divine qui embrase la matière.",
        "Dans le tarot, Éros correspond au feu du commencement, celui qui allume la passion, stimule la créativité et donne le courage de s’unir à l’autre ou à une idée avec ferveur.",
        "Il invite à honorer le désir comme une prière de la chair, un chant du vivant qui cherche à se reconnaître dans l’autre.",
        "Son énergie n’est pas seulement sexuelle : elle est la puissance même de la vie qui veut danser."
      ]
    },
    {
      "subtitle": "Mots-clés lumière :",
      "paragraphs": [
        "Désir sacré, vitalité, créativité, union, inspiration, sensualité, énergie primordiale."
      ]
    },
    {
      "subtitle": "Ombre :",
      "paragraphs": [
        "La possession et la brûlure du désir, quand Éros n’est plus canalisé, il devient incendie.",
        "Le feu du cœur se transforme en consommation, en besoin de contrôle, en dépendance à l’objet du désir.",
        "L’amour devient alors faim, jalousie, conquête.",
        "Cette ombre d’Éros rappelle la fragilité du feu : ce qui éclaire peut aussi détruire.",
        "L’excès d’Éros consume sans nourrir, et laisse derrière lui la cendre de l’épuisement.",
        "Cette carte en déséquilibre invite à ralentir le feu, à rétablir la respiration entre passion et conscience, à retrouver la douceur d’Agapè."
      ]
    },
    {
      "subtitle": "Mots-clés ombre :",
      "paragraphs": [
        "Dépendance, obsession, manipulation, domination, déflagration émotionnelle, perte de sens."
      ]
    },
    {
      "subtitle": "Chemins d’intégration :",
      "paragraphs": [
        "Transformer le désir en force créatrice consciente.",
        "Écouter le corps sans s’y enfermer.",
        "Canaliser la pulsion en art, en mouvement, en offrande.",
        "Trouver la frontière juste entre passion et destruction.",
        "Dans un tirage, Éros appelle à oser vivre l’intensité, à allumer le feu sans en devenir",
        "prisonnier."
      ]
    },
    {
      "subtitle": "Exercice / Méditation :",
      "paragraphs": [
        "Inspire profondément par le ventre.",
        "Visualise une flamme rouge et dorée qui s’élève du bas de ton corps jusqu’à ton cœur.",
        "À chaque souffle, laisse-la éclairer sans consumer. Laisse la chaleur du désir devenir lumière de création. Éros est la force qui met le monde en mouvement.",
        "Il est la racine du chant, du geste, du regard aimant.",
        "Sa nature est paradoxale : à la fois dangereuse et nécessaire, éphémère et éternelle.",
        "Dans le grand cycle du Tarot Fleur d’ÅmÔurs, Éros est la pulsion de vie incarnée, le feu qui précède la fleur, le désir qui cherche à devenir amour."
      ]
    },
    {
      "subtitle": "Résonance de l’Âme :",
      "paragraphs": [
        "Éros est l’expression de l’élan vital pur, la force de vie qui s’oppose à la stagnation et à la mort psychique. En résonance d’âme, Éros demande si le consultant permet à son énergie sexuelle et créative de circuler sans être détournée par le refoulement ou les schémas compensatoires. C’est la première étape vers la transmutation : identifier ce qui nous anime fondamentalement."
      ]
    },
    {
      "subtitle": "Correspondances énergétiques :",
      "paragraphs": [],
      "correspondances": {
        "Élément": "Feu",
        "Polarité": "Masculine active (moteur, pénétrante, impulsive)",
        "Correspondances symboliques": "Graine en germination, Flamme naissante, Force de vie",
        "En résonance": "Feu (La Flamme), Terre (Le Minéral), Eau (La Vague)"
      }
    },
    {
      "subtitle": "Question Racine :",
      "paragraphs": [
        "«Qu’est-ce qui, dans ma vie, me donne envie de me lever et de créer avec",
        "ferveur ?»"
      ]
    }
  ]
}