{
  "name": "LA GERMINATION",
  "slug": "la_germination",
  "info": [
    "Incarne le début sacré et l’éveil du potentiel. La graine qui s’ouvre et envoie ses premières racines et sa première pousse vers la lumière représente le moment miraculeux du commencement. Symbolise le courage de naître, la vulnérabilité du départ et la force de l’élan vital."
  ],
  "sections": [
    {
      "subtitle": "Description étendue :",
      "paragraphs": [
        "La Germination est le cri silencieux du vivant qui s’éveille.",
        "C’est le moment de l’émergence, du premier souffle, de la confiance pure en la croissance.",
        "Dans le tarot, elle symbolise le courage de commencer, l’élan vital qui pousse vers la lumière sans savoir encore ce qu’il deviendra.",
        "Elle enseigne la foi, l’enthousiasme, la capacité de se mettre en mouvement sans tout comprendre.",
        "C’est la carte du printemps intérieur, du cœur qui s'éveille à la vie après le sommeil."
      ]
    },
    {
      "subtitle": "Mots-clés lumière :",
      "paragraphs": [
        "Éveil, commencement, foi, confiance, énergie vitale, enthousiasme, impulsion, croissance, renouveau."
      ]
    },
    {
      "subtitle": "Ombre :",
      "paragraphs": [
        "La précipitation ou la fragilité du départ. Sous son ombre, La Germination devient fragile.",
        "L’élan est trop brusque, la jeune pousse s’épuise avant de s’enraciner.",
        "C’est la carte de l’impatience, du doute, ou de la peur du rejet de la lumière.",
        "Elle avertit contre le risque de sortir du sol avant d’être prêt, ou de ne pas croire en sa propre force.",
        "Toute naissance demande protection et douceur."
      ]
    },
    {
      "subtitle": "Mots-clés ombre :",
      "paragraphs": [
        "Précipitation, impatience, fragilité, peur de l’échec, vulnérabilité, dispersion, doutes précoces."
      ]
    },
    {
      "subtitle": "Chemins d’intégration :",
      "paragraphs": [
        "Célébrer chaque début comme une promesse.",
        "Avancer avec confiance, sans vouloir tout maîtriser.",
        "Protéger ce qui naît sans le retenir.",
        "Honorer le courage d’oser, même dans l’incertitude.",
        "Dans un tirage, La Germination annonce un nouveau départ, une naissance symbolique, un réveil créatif ou spirituel, et invite à entretenir cet élan avec douceur."
      ]
    },
    {
      "subtitle": "Exercice / Méditation :",
      "paragraphs": [
        "Assieds-toi en silence.",
        "Pose une main sur ton ventre, l’autre sur ton cœur.",
        "Imagine une graine s’ouvrant en toi, libérant une petite pousse lumineuse. Respire profondément et laisse-la grandir au rythme de ton souffle.",
        "La Germination est le frisson de la vie qui recommence.",
        "Elle incarne le courage du premier geste, la foi du vivant qui pousse vers le jour.",
        "Dans le grand cycle du Tarot Fleur d’ÅmÔurs, elle symbolise l’éveil de la conscience après le repos, le passage de l’invisible au manifeste.",
        "Elle enseigne que chaque renaissance est un acte de foi, et que la lumière ne se cherche pas : elle s’invite dès qu’on ose croître."
      ]
    },
    {
      "subtitle": "Correspondances énergétiques :",
      "paragraphs": [],
      "correspondances": {
        "Élément": "Eau et Feu",
        "Polarité": "Masculine ascendante (éveil, élan, expansion)",
        "Correspondances symboliques": "Éveil, Naissance, Mouvement de la sève",
        "En résonance": "Feu (La Flamme), Eau (La Pluie), Ether (L’Harmonie des Cycles)"
      }
    },
    {
      "subtitle": "Question Racine :",
      "paragraphs": [
        "«Quel est le tout premier petit pas que je peux faire, même si je tremble ?»"
      ]
    }
  ]
}