{
  "name": "PRAGMA",
  "slug": "pragma",
  "info": [
    "Incarne l’amour mature et pragmatique. C’est l’amour qui dure dans le temps, basé sur la compatibilité, la patience et les compromis. Cette carte représente l’engagement conscient, la construction à deux et la sagesse relationnelle."
  ],
  "sections": [
    {
      "subtitle": "Description étendue",
      "paragraphs": [
        "L’amour mûr et conscient Pragma est l’amour qui a traversé les saisons.",
        "C’est la fidélité à travers le temps, le soin patient des fondations, la maturité du sentiment qui ne cherche plus à séduire mais à durer.",
        "Elle enseigne la persévérance, la co-création, la construction partagée.",
        "Dans le tarot, Pragma est la pierre d’angle du temple intérieur, l’amour qui se choisit chaque jour.",
        "Elle parle d’engagement lucide, d’ancrage, de responsabilité douce. C’est l’équilibre entre le rêve et la réalité, la passion et la paix."
      ]
    },
    {
      "subtitle": "Mots-clés lumière :",
      "paragraphs": [
        "Maturité, stabilité, fidélité, persévérance, confiance, constance, bâtir ensemble, sagesse relationnelle."
      ]
    },
    {
      "subtitle": "Ombre :",
      "paragraphs": [
        "La routine et l’usure du lien.",
        "Quand Pragma se fige, l’amour devient habitude.",
        "Le feu sacré s’éteint dans la répétition, le lien se transforme en contrat ou en devoir.",
        "L’attachement au confort ou à la sécurité étouffe la vitalité.",
        "L’ombre de Pragma est la cristallisation du cœur, la peur du changement, la perte de regard neuf sur l’autre.",
        "Cette carte, dans son revers, rappelle que la stabilité doit rester vivante : elle ne doit jamais se confondre avec la stagnation."
      ]
    },
    {
      "subtitle": "Mots-clés ombre :",
      "paragraphs": [
        "Routine, inertie, peur du changement, désenchantement, repli, inertie émotionnelle, oubli de la flamme."
      ]
    },
    {
      "subtitle": "Chemins d’intégration :",
      "paragraphs": [
        "Réenchanter l’amour par la gratitude et le jeu.",
        "Honorer les fondations tout en accueillant le mouvement.",
        "Faire de la fidélité du cœur un acte de liberté.",
        "Bâtir sans posséder, aimer sans s’user.",
        "Dans un tirage, Pragma évoque un engagement solide, un amour durable, ou la nécessité de redonner souffle à une relation trop figée."
      ]
    },
    {
      "subtitle": "Exercice / Méditation :",
      "paragraphs": [
        "Pense à une relation ou un projet ancien.",
        "Observe ce qui, en lui, continue de te nourrir, et ce qui demande à être renouvelé.",
        "Respire la gratitude pour ce qui dure, puis souffle doucement sur les braises de ce qui sommeille.",
        "Pragma est l’amour qui devient œuvre.",
        "Elle incarne le mariage du temps et de la conscience.",
        "Elle nous apprend que l’amour véritable n’est pas un état, mais un mouvement stable : un jardin qu’il faut entretenir, un feu qu’il faut veiller.",
        "Dans le grand cycle du Tarot Fleur d’ÅmÔurs, Pragma est la pierre d’équilibre entre la passion et la paix, la mémoire et la nouveauté.",
        "Elle enseigne la beauté du durable, l’art d’aimer longtemps, avec clarté et profondeur."
      ]
    },
    {
      "subtitle": "Résonance de l’Âme :",
      "paragraphs": [
        "Pragma est l’énergie de la réalisation concrète et de l’engagement à long terme. Elle est souvent reliée au Mage ou à l’Architecte intérieur. La lecture transpersonnelle demande si le consultant est capable d’ancrer ses visions spirituelles (Agapè) ou ses passions (Éros) dans la matière et la durée. C’est le test de la maturité et de la capacité à manifester le Soi dans le monde."
      ]
    },
    {
      "subtitle": "Correspondances énergétiques :",
      "paragraphs": [],
      "correspondances": {
        "Élément": "Terre et Air",
        "Polarité": "Équilibrée (ancrée dans le réel et consciente du lien)",
        "Correspondances symboliques": "Pierre polie, Construction, Alliance stable",
        "En résonance": "Terre (La Roche-Mère), Feu (Le Cœur du Feu), Ether (L’Harmonie des Cycles)"
      }
    },
    {
      "subtitle": "Question Racine :",
      "paragraphs": [
        "«Quel engagement concret puis-je prendre pour solidifier ce que je construis ?»"
      ]
    }
  ]
}