{
  "name": "LE MESSAGER",
  "slug": "le_messager",
  "info": [
    "Incarne la transmission entre les mondes. L’oiseau en vol, guidé par l’étoile, représente celui qui porte les nouvelles, les intentions et les prières. Symbolise la communication claire, la guidance spirituelle et la liberté de l’esprit qui voyage au-delà des frontières."
  ],
  "sections": [
    {
      "subtitle": "Description étendue :",
      "paragraphs": [
        "Le porteur de lumière et la communication du ciel et de la terre",
        "Le Messager est l’incarnation du lien.",
        "Il ne parle pas pour lui-même : il est le souffle de la conscience, la voix du monde, la pensée qui voyage entre les êtres.",
        "Dans le tarot, il symbolise la communication inspirée, la guidance intérieure, les synchronicités et la circulation des messages invisibles.",
        "C’est la carte de la médiation, du service, de la clarté du canal.",
        "Elle enseigne la transparence : être traversé sans se confondre, être voix sans appropriation.",
        "Le Messager ne possède rien il transmet la lumière."
      ]
    },
    {
      "subtitle": "Mots-clés lumière :",
      "paragraphs": [
        "Transmission, intuition, guidance, communication consciente, lien spirituel, synchronicité, transparence, fluidité, clarté."
      ]
    },
    {
      "subtitle": "Ombre :",
      "paragraphs": [
        "L’orgueil du message ou la confusion du canal.",
        "Sous son ombre, Le Messager devient messie autoproclamé ou interprète brouillé.",
        "Le message se déforme, le canal se trouble.",
        "C’est la carte de la mésinterprétation, de l’ego spirituel, ou du bavardage inspiré sans ancrage.",
        "Elle avertit, transmettre demande humilité et silence intérieur. Le vent qui parle trop fort ne transporte plus rien."
      ]
    },
    {
      "subtitle": "Mots-clés ombre :",
      "paragraphs": [
        "Désinformation, confusion, orgueil spirituel, bavardage mystique, perte de sens, interprétation erronée, agitation mentale."
      ]
    },
    {
      "subtitle": "Chemins d’intégration :",
      "paragraphs": [
        "Se relier à l’intention pure avant toute transmission.",
        "Laisser les messages venir sans forcer, sans les retenir.",
        "Parler ou agir seulement quand le souffle est clair.",
        "Se rappeler que l’écoute est aussi une forme de message.",
        "Dans un tirage, Le Messager annonce des nouvelles, une révélation, une guidance, ou la reconnaissance d’un lien subtil avec autrui ou l’invisible.",
        "Il appelle à devenir canal conscient de la vérité intérieure."
      ]
    },
    {
      "subtitle": "Exercice / Méditation :",
      "paragraphs": [
        "Assieds-toi en silence.",
        "Imagine un fil de lumière reliant ton cœur au ciel et à la terre. Respire profondément et sens-toi traversé par un souffle d’or. Écoute : un mot, une image, une sensation vient.",
        "Ne la retiens pas laisse-la passer, pure et libre.",
        "Le Messager est le souffle conscient du monde, l’esprit du vent qui relie tout ce qui respire.",
        "Il enseigne que la véritable communication ne vient pas de la volonté de dire, mais de la disponibilité à recevoir.",
        "Dans le grand Tarot Fleur d’ÅmÔurs, il représente l’intelligence circulaire de la Vie, la parole qui se propage comme une onde d’amour et de vérité.",
        "Il nous rappelle que nous sommes tous messagers des souffles en transit entre le silence et la lumière."
      ]
    },
    {
      "subtitle": "Correspondances énergétiques :",
      "paragraphs": [],
      "correspondances": {
        "Élément": "Air et Éther",
        "Polarité": "Neutre et lumineuse (transmettrice, consciente, inspirée)",
        "Correspondances symboliques": "Transmission, Guidance, Connexion entre les mondes",
        "En résonance": "Feu (Le Cœur du Feu), Eau (L’Estuaire), Vie (L’Âme du Monde)"
      }
    },
    {
      "subtitle": "Question Racine :",
      "paragraphs": [
        "«À quel signe ou à quelle coïncidence dois-je prêter attention aujourd’hui ?»"
      ]
    }
  ]
}