{
  "name": "AGAPÈ",
  "slug": "agape",
  "info": [
    "Représente l’amour universel et inconditionnel. C’est l’amour désintéressé qui embrasse toute l’humanité, la compassion sans limite et la charité divine. Cette carte symbolise l’altruisme pur et la bienveillance cosmique."
  ],
  "sections": [
    {
      "subtitle": "Description étendue :",
      "paragraphs": [
        "Le don sans condition",
        "Agapè est la vibration la plus pure de l’amour.",
        "Elle transcende le désir, l’attachement et la possession.",
        "C’est l’amour qui voit sans juger, qui offre sans attendre, qui relie sans enfermer.",
        "Dans le tarot, elle incarne la fleur pleinement épanouie, celle qui accueille la lumière et la redistribue.",
        "Tirer cette carte, c’est une invitation à l’ouverture du cœur, à la gratitude, à la circulation de l’énergie d’amour dans toutes les directions.",
        "C’est la conscience que l’autre est un miroir du divin, que la relation devient prière."
      ]
    },
    {
      "subtitle": "Mots-clés lumière :",
      "paragraphs": [
        "Compassion, unité, bénédiction, rayonnement, bienveillance, service, communion."
      ]
    },
    {
      "subtitle": "Ombre :",
      "paragraphs": [
        "L’amour qui se sacrifie ou se dissout",
        "Lorsque la vibration d’Agapè se déséquilibre, elle se transforme en oubli de soi, en fusion excessive, en fuite dans l’idéal spirituel.",
        "C’est la lumière qui brûle celui qui ne sait plus poser de limite.",
        "On peut y perdre son centre, vouloir sauver le monde pour ne pas se sauver soi-même.",
        "Dans ce sens, la carte d’Agapè met en garde : l’amour sans ancrage devient illusion.",
        "Elle appelle à revenir à la terre, à l’incarnation, à la reconnaissance de ses propres besoins comme autant d’actes d’amour envers soi."
      ]
    },
    {
      "subtitle": "Mots-clés ombre :",
      "paragraphs": [
        "Dissolution, déni de soi, dépendance spirituelle, martyr, fuite du réel, orgueil lumineux."
      ]
    },
    {
      "subtitle": "Chemins d’intégration :",
      "paragraphs": [
        "S’unir sans se perdre : apprendre à donner en restant enraciné.",
        "Cultiver l’amour universel sans nier la singularité de chaque être.",
        "Lier le cœur (Agapè) au corps (Philautia) et à l’action (Pragma).",
        "Dans un tirage, Agapè vient souvent rappeler la finalité du cycle : toute relation, tout processus, tend vers l’unité du vivant."
      ]
    },
    {
      "subtitle": "Exercice / Méditation :",
      "paragraphs": [
        "Visualise une lumière blanche rayonnant depuis ton cœur.",
        "Chaque inspiration attire l’amour universel, chaque expiration le diffuse autour de toi.",
        "Observe jusqu’où il se propage, sans effort, sans attente. Agapè est la fleur solaire de la conscience aimante.",
        "Elle ne pousse qu’à partir de racines bien ancrées et de pétales ouverts à la diversité.",
        "Dans le grand cycle du Tarot Fleur d’ÅmÔurs, elle représente la source matricielle de toute relation harmonieuse, le souffle d’amour qui traverse le monde avant de se manifester sous d’autres formes (Éros, Philia, Pragma, etc.)."
      ]
    },
    {
      "subtitle": "Résonance de l’Âme :",
      "paragraphs": [
        "L’apparition d’Agapè invite à l’activation du circuit de l’unité et de la non-dualité. Elle signale que le Soi (le centre organisateur de la psyché) est en train de s’aligner sur la conscience universelle. Le défi n’est pas d’aimer l’autre, mais de démanteler l’illusion de la séparation qui empêche l’amour inconditionnel de circuler."
      ]
    },
    {
      "subtitle": "Correspondances énergétiques :",
      "paragraphs": [],
      "correspondances": {
        "Élément": "Éther",
        "Polarité": "Féminine active (réceptive et rayonnante)",
        "Correspondances symboliques": "Fleur ouverte, Soleil intérieur, Unité du Vivant",
        "En résonance": "Vie (L’Âme du Monde), Air (Le Verbe), Eau (La Source Profonde)"
      }
    },
    {
      "subtitle": "Question Racine :",
      "paragraphs": [
        "« Où puis-je donner aujourd’hui sans absolument rien attendre en retour ? »"
      ]
    }
  ]
}