{
  "name": "LA SOURCE PROFONDE",
  "slug": "la_source_profonde",
  "info": [
    "Symbolise les ressources intérieures et l’origine cachée. L’eau souterraine qui monte à travers les strates de la terre représente la sagesse enfouie, les nappes phréatiques de l’inconscient et la résilience qui puise en profondeur. C’est la carte de l’authenticité et du retour à soi."
  ],
  "sections": [
    {
      "subtitle": "Description étendue :",
      "paragraphs": [
        "L’origine de la vie et la mémoire du cœur.",
        "La Source Profonde est le commencement invisible, le lieu d'où tout jaillit.",
        "Elle est la mémoire du monde, la pureté des origines, la matrice des émotions vraies.",
        "Dans le tarot, elle symbolise le retour à soi, la reconnexion à l’intuition, la guérison intérieure par la douceur.",
        "C’est la carte du cœur apaisé, de la paix retrouvée dans les profondeurs.",
        "Elle enseigne que la clarté vient de la profondeur : plus on plonge, plus l’eau devient pure."
      ]
    },
    {
      "subtitle": "Mots-clés lumière :",
      "paragraphs": [
        "Origine, pureté, mémoire, intuition, guérison, émotion vraie, source de vie, paix intérieure."
      ]
    },
    {
      "subtitle": "Ombre :",
      "paragraphs": [
        "Le refoulement ou la noyade intérieure. Sous son ombre, la Source devient puits sans fond.",
        "C’est la carte du refoulement émotionnel, de la fuite dans les profondeurs ou de la mélancolie stagnante.",
        "On peut s’y perdre à force de creuser sans remonter.",
        "L’ombre avertit, l’introspection sans retour vers la surface devient oubli de soi.",
        "Il faut boire, non se noyer."
      ]
    },
    {
      "subtitle": "Mots-clés ombre :",
      "paragraphs": [
        "Mélancolie, stagnation, fuite, confusion émotionnelle, isolement, douleur refoulée, excès d’introspection."
      ]
    },
    {
      "subtitle": "Chemins d’intégration :",
      "paragraphs": [
        "Accueillir ses émotions sans s’y engloutir.",
        "Plonger dans ses profondeurs pour y puiser la sagesse.",
        "Retrouver la paix du cœur par le silence et l’écoute intérieure.",
        "Laisser la Vie couler à nouveau sans résistance.",
        "Dans un tirage, La Source Profonde signale un retour à l’essentiel, une guérison en cours, ou une connexion à l’origine de la vie émotionnelle."
      ]
    },
    {
      "subtitle": "Exercice / Méditation :",
      "paragraphs": [
        "Ferme les yeux.",
        "Imagine-toi debout au bord d’une source claire. Plonge tes mains dans l’eau et porte-les à ton cœur. Sens la fraîcheur te purifier, t’apaiser.",
        "Cette source coule en toi depuis toujours.",
        "La Source Profonde est le cœur liquide du monde, la sagesse de l’eau originelle.",
        "Elle enseigne que toute guérison vient du retour à la fluidité, que la paix intérieure est un jaillissement, non une conquête.",
        "Dans le grand Tarot Fleur d’ÅmÔurs, elle représente le commencement des émotions conscientes, le moment où l’amour et la mémoire se rencontrent.",
        "Elle nous rapelle que l’eau ne garde pas : elle se souvient, puis elle coule."
      ]
    },
    {
      "subtitle": "Correspondances énergétiques :",
      "paragraphs": [],
      "correspondances": {
        "Élément": "Eau",
        "Polarité": "Féminine matricielle (nourricière, intuitive, originelle)",
        "Correspondances symboliques": "Origine, Mémoire, Flux primordial",
        "En résonance": "Terre (La Roche-Mère), Végétal (La Graine Endormie), Vie (L’Âme du Monde)"
      }
    },
    {
      "subtitle": "Question Racine :",
      "paragraphs": [
        "«Quelle est l'intuition profonde, que j’entends chuchoter mais que je n’ose pas écouter ?»"
      ]
    }
  ]
}