{
  "name": "L’HUMUS",
  "slug": "l_humus",
  "info": [
    "Représente la fertilité de la décomposition et le cycle de la vie. C’est la richesse qui naît de ce qui meurt, la transformation du passé en nourriture pour l’avenir. Symbolise l’interconnexion, le réseau souterrain invisible et la renaissance."
  ],
  "sections": [
    {
      "subtitle": "Description étendue :",
      "paragraphs": [
        "La transformation féconde. L’Humus est la mémoire fertile du monde.",
        "C’est la matière qui s’est offerte à la transformation et qui, par ce don, devient nourriture.",
        "Dans le tarot, cette carte incarne la régénération : le pouvoir de renaître à partir de ce qui fut détruit.",
        "Elle enseigne la confiance dans les cycles, la gratitude envers la fin des choses, et la joie d’une nouvelle vitalité issue du passé.",
        "L’Humus nous rappelle que rien ne se perd tout se transforme.",
        "Dans l’humus du cœur, les douleurs d’hier deviennent racines pour demain."
      ]
    },
    {
      "subtitle": "Mots-clés lumière :",
      "paragraphs": [
        "Régénération, fertilité, transformation, guérison, intégration, patience, cycle naturel, sagesse du temps."
      ]
    },
    {
      "subtitle": "Ombre :",
      "paragraphs": [
        "Le refus du changement ou la stagnation",
        "Sous son ombre, l’Humus devient boue : tout s’y mélange sans distinction, l’énergie stagne, la vie s’y étouffe.",
        "C’est la carte du ressassement, de l’attachement au passé ou des émotions non digérées.",
        "Elle avertit, sans circulation, la fertilité se transforme en inertie.",
        "Elle appelle à accueillir la mort symbolique des anciennes formes pour laisser la Vie circuler à nouveau."
      ]
    },
    {
      "subtitle": "Mots-clés ombre :",
      "paragraphs": [
        "Répétition, attachement, mélancolie, stagnation, fatigue émotionnelle, refus de lâcher prise."
      ]
    },
    {
      "subtitle": "Chemins d’intégration :",
      "paragraphs": [
        "Offrir au sol intérieur ce qui doit être transformé.",
        "Cesser de lutter contre la fin d’un cycle.",
        "Comprendre que la perte n’est qu’une métamorphose.",
        "Laisser la vie recycler tes expériences.",
        "Dans un tirage, L’Humus annonce une période de digestion intérieure, un passage de transformation lente mais certaine, où le temps travaille pour toi."
      ]
    },
    {
      "subtitle": "Exercice / Méditation :",
      "paragraphs": [
        "Allonge-toi au sol ou imagine-toi couché sur la terre. Visualise tes anciens schémas, tes peurs, tes émotions.",
        "Vois-les se dissoudre doucement dans la terre sombre et tiède.",
        "À chaque expiration, offre-les au sol. À chaque inspiration, ressens la vie neuve qui revient.",
        "L’Humus est la sagesse de la terre qui pardonne tout.",
        "Il enseigne que la mort et la vie ne s’opposent pas, qu’elles sont la même respiration à deux temps.",
        "Dans le grand cycle du Tarot Fleur d’ÅmÔurs, il représente le processus alchimique de l’incarnation, la digestion du passé qui rend possible la floraison future.",
        "Il nous rappelle que la vraie lumière naît souvent des profondeurs : ce que tu laisses mourir devient ton terreau."
      ]
    },
    {
      "subtitle": "Correspondances énergétiques :",
      "paragraphs": [],
      "correspondances": {
        "Élément": "Terre et Eau",
        "Polarité": "Féminine profonde (régénératrice, transformatrice, maternelle)",
        "Correspondances symboliques": "Décomposition, Renaissance, Alliance de la matière et de l’esprit",
        "En résonance": "Eau (L’Estuaire), Feu (La Braise), Vie (L’Abeille)"
      }
    },
    {
      "subtitle": "Question Racine :",
      "paragraphs": [
        "«Quel échec ou quelle perte passée peut servir d’engrais à ma réussite",
        "d’aujourd’hui ?»"
      ]
    }
  ]
}