{
  "name": "L’ESTUAIRE",
  "slug": "l_estuaire",
  "info": [
    "Représente la rencontre et la synthèse. Là où le fleuve rejoint l’océan, où l’eau douce épouse l’eau salée, les oiseaux marquent la liberté de passage entre les mondes. Symbolise l’intégration des polarités, les zones de mélanges fertiles et les transitions harmonieuses."
  ],
  "sections": [
    {
      "subtitle": "Description étendue :",
      "paragraphs": [
        "La rencontre et l’harmonie des contraires. L’Estuaire est la carte de la réconciliation fluide.",
        "C’est l’endroit où la rivière renonce à sa course solitaire pour rejoindre la mer, sans se perdre, mais en devenant plus vaste.",
        "Elle incarne l’acceptation, la souplesse, la fin des dualités.",
        "Dans le tarot, L’Estuaire invite à unir les polarités : féminin et masculin, intérieur et extérieur, action et réception.",
        "C’est la sagesse du mélange, la beauté des zones d’entre-deux.",
        "Elle enseigne que l’équilibre n’est pas l’immobilité, mais la respiration entre les forces."
      ]
    },
    {
      "subtitle": "Mots-clés lumière :",
      "paragraphs": [
        "Union, réconciliation, fluidité, tolérance, fusion, complémentarité, passage, équité, accueil."
      ]
    },
    {
      "subtitle": "Ombre :",
      "paragraphs": [
        "La dilution ou la confusion des limites. Sous son ombre, L’Estuaire devient marécage.",
        "Les frontières se dissolvent au point de perdre toute distinction.",
        "C’est la carte du flou identitaire, de la fusion excessive, ou du compromis qui étouffe la vérité.",
        "Elle avertit, unir n’est pas se dissoudre.",
        "Le danger est de confondre harmonie et absence de forme. Chaque courant garde sa couleur même dans la rencontre."
      ]
    },
    {
      "subtitle": "Mots-clés ombre :",
      "paragraphs": [
        "Confusion, dépendance, perte de soi, compromission, indécision, fatigue relationnelle, suradaptation."
      ]
    },
    {
      "subtitle": "Chemins d’intégration :",
      "paragraphs": [
        "Apprendre à unir sans se confondre.",
        "Trouver sa place dans le flux collectif.",
        "Célébrer les zones grises comme des lieux de Vie.",
        "Pratiquer l’écoute mutuelle et la coopération sincère.",
        "Dans un tirage, L’Estuaire indique une réconciliation, une union féconde, une relation équilibrée ou une transition harmonieuse.",
        "C’est une carte de rencontre, de paix et d’intégration."
      ]
    },
    {
      "subtitle": "Exercice / Méditation :",
      "paragraphs": [
        "Ferme les yeux et visualise deux courants d’eau se rejoignant. Observe leurs couleurs, leurs vitesses, leurs sons.",
        "Laisse-les s’unir lentement, sans les forcer.",
        "Respire et sens en toi ce point d’équilibre : ni résistance, ni fusion totale",
        "juste la danse des marées.",
        "L’Estuaire est la bouche de la Terre où les eaux se parlent.",
        "Elle incarne la sagesse du mélange, la beauté des nuances, la rencontre féconde entre différences.",
        "Dans le grand Tarot Fleur d’ÅmÔurs, elle représente l’union consciente, la réconciliation du fleuve et de la mer, du “moi” et du “tout”.",
        "Elle enseigne que l’amour véritable n’efface pas les contours : il les relie. L’Estuaire est le visage de la paix liquide."
      ]
    },
    {
      "subtitle": "Correspondances énergétiques :",
      "paragraphs": [],
      "correspondances": {
        "Élément": "Eau et Terre",
        "Polarité": "Équilibrée (intégratrice, adaptative, réconciliatrice)",
        "Correspondances symboliques": "Union, Transition, Harmonie entre opposés",
        "En résonance": "Terre (L’Humus), Feu (La Cendre Fertile), Ether (L’Harmonie des Cycles)"
      }
    },
    {
      "subtitle": "Question Racine :",
      "paragraphs": [
        "«Quelles sont les deux parts de moi (ou de ma vie) qui cherchent à se réconcilier ?»"
      ]
    }
  ]
}