{
  "name": "LA CENDRE FERTILE",
  "slug": "la_cendre_fertile",
  "info": [
    "Évoque la régénération par le feu. Symbolise la purification nécessaire, la destruction créatrice et la renaissance qui suit la perte. Cette carte parle de renouveau radical, de cycles qui se terminent pour permettre de nouveaux départs."
  ],
  "sections": [
    {
      "subtitle": "Description étendue :",
      "paragraphs": [
        "La renaissance après la transmutation.",
        "La Cendre Fertile est la matière réconciliée : ce qui a brûlé a été purifié, et maintenant nourrit.",
        "C’est la carte de la libération, de la transformation achevée, du renouveau total.",
        "Dans le tarot, elle symbolise la sagesse acquise par l’épreuve, la fécondité née de la perte, la paix après la tempête.",
        "Elle enseigne que tout feu véritable laisse derrière lui un sol plus riche, et que rien ne se perd dans la spirale du vivant.",
        "C’est le passage du feu destructeur au feu alchimique, de la fin à la promesse."
      ]
    },
    {
      "subtitle": "Mots-clés lumière :",
      "paragraphs": [
        "Renaissance, régénération, purification, sagesse, transformation, renouveau, équilibre, continuité, paix."
      ]
    },
    {
      "subtitle": "Ombre :",
      "paragraphs": [
        "L’oubli ou la fuite dans la légèreté",
        "Sous son ombre, la Cendre Fertile devient poussière : un détachement sans incarnation, une fuite vers le ciel en oubliant la terre.",
        "C’est la carte de l’évitement spirituel, du désir de transcendance qui néglige la reconstruction.",
        "Elle avertit, la cendre ne nourrit que si elle retourne au sol. La lumière doit redevenir matière pour boucler le cycle."
      ]
    },
    {
      "subtitle": "Mots-clés ombre :",
      "paragraphs": [
        "Fuite, déni, volatilité, oubli du corps, détachement excessif, perte d’ancrage,",
        "désincarnation."
      ]
    },
    {
      "subtitle": "Chemins d’intégration :",
      "paragraphs": [
        "Accueillir les fins comme des commencements.",
        "Reconnaître la beauté de ce qui a brûlé.",
        "Intégrer la lumière dans la matière : spiritualiser la vie quotidienne.",
        "Répandre la sagesse acquise sur le monde.",
        "Dans un tirage, La Cendre Fertile annonce la fin d’un cycle, la paix après le feu, une transformation profonde et durable, ou la naissance d’une nouvelle vision issue d’une épreuve."
      ]
    },
    {
      "subtitle": "Exercice / Méditation :",
      "paragraphs": [
        "Allume un feu, une brindille.",
        "Regarde la flamme jusqu’à ce qu’elle se stabilise, puis ferme les yeux.",
        "Visualise la lumière se transformer en cendre tiède qui tombe dans ton cœur.",
        "De cette cendre naît un germe vert : la vie qui repart. La Cendre Fertile est le sourire de la Terre après le feu.",
        "Elle incarne le cycle accompli, la sagesse née de la transformation.",
        "Dans le grand Tarot Fleur d’ÅmÔurs, elle représente l’union finale de la matière et de l’esprit, la paix intérieure issue du feu de l’expérience.",
        "Elle nous enseigne que la fin n’existe pas : tout brûle pour nourrir, tout s’éteint pour renaître.",
        "Devenir cendre fertile, c’est devenir mémoire vivante,c'est le sol d’où surgira la prochaine fleur."
      ]
    },
    {
      "subtitle": "Correspondances énergétiques :",
      "paragraphs": [],
      "correspondances": {
        "Élément": "Feu et Terre",
        "Polarité": "Équilibrée (transformatrice, régénératrice)",
        "Correspondances symboliques": "Renaissance, Purification, Mémoire du feu",
        "En résonance": "Feu (Les Braises), Eau (L’Estuaire), Vie (L’Âme du Monde)"
      }
    },
    {
      "subtitle": "Question Racine :",
      "paragraphs": [
        "«Qu’est-ce qui est définitivement fini et que je dois accepter pour renaître ?»"
      ]
    }
  ]
}