{
  "name": "LE GRAND PASSAGE",
  "slug": "le_grand_passage",
  "info": [
    "Le Grand Passage est la porte entre deux mondes. Il ne s’agit pas d’une fin, mais d’un glissement, d’un retour au mouvement essentiel du vivant.\nIl représente l’instant où la forme s’efface pour redevenir énergie, où la conscience rend son souffle à l’invisible."
  ],
  "sections": [
    {
      "subtitle": "Description étendue :",
      "paragraphs": [
        "Cette carte évoque les grandes transitions : la mort, bien sûr, mais aussi toutes les métamorphoses qui demandent de quitter l’ancien pour renaître autrement.",
        "Elle parle de détachement, d’abandon confiant, d’accueil du vide comme matrice fertile.",
        "Dans le Grand Passage, rien n’est à craindre, seule résiste la part qui ne veut pas s’ouvrir.",
        "C’est le seuil sacré où l’humain cesse de vouloir “comprendre” pour consentir à traverser.",
        "Elle nous enseigne que mourir est un acte de confiance : laisser la vie reprendre sa forme originelle en nous.",
        "Le Grand Passage est une invitation à la foi nue, à la paix devant l’inévitable, à la tendresse face à ce qui s’éteint.",
        "Ce qui disparaît ici renaît ailleurs.",
        "Ce qui meurt n’est jamais perdu, seulement transformé.",
        "Libération, transcendance, paix dans le lâcher-prise.",
        "Confiance dans les cycles naturels de la vie et de la mort.",
        "Acceptation du changement comme chemin vers la lumière."
      ]
    },
    {
      "subtitle": "Mots-clés lumière :",
      "paragraphs": [
        "Transmutation, Foi, Détachement, Passage, Renouveau, Liberté intérieure, Recyclage sacré."
      ]
    },
    {
      "subtitle": "Ombre :",
      "paragraphs": [
        "Peur de la mort, refus du changement, attachement au connu.",
        "Incapacité à faire le deuil, résistance au flux du vivant."
      ]
    },
    {
      "subtitle": "Mots-clés ombre :",
      "paragraphs": [
        "Blocage, Déni, Refus, Peur, Fixation, Clôture."
      ]
    },
    {
      "subtitle": "Chemin d’intégration :",
      "paragraphs": [
        "Ne cherche pas à retenir ce qui s’en va.",
        "Remercie ce qui t’a accompagné, puis laisse partir avec douceur.",
        "Fais confiance à l’intelligence du vivant : il ne détruit jamais, il transforme.",
        "Traverse le seuil sans lutter. Ce que tu crois perdre, tu le redeviens sous une autre forme."
      ]
    },
    {
      "subtitle": "Exercice / méditation :",
      "paragraphs": [
        "Assieds-toi dans le calme.",
        "Pense à une situation, une relation, une partie de toi que tu sens prête à s’achever.",
        "Respire profondément.",
        "Inspire la gratitude, expire la libération.",
        "Visualise une flamme douce devant toi : confie-lui ce que tu quittes.",
        "Observe la fumée s’élever, se dissoudre.",
        "Répète intérieurement :",
        "« Je rends au feu ce qui a vécu. J’entre dans le nouveau souffle. »"
      ]
    },
    {
      "subtitle": "Résonance de l’Âme :",
      "paragraphs": [
        "Dans une lecture d’âme, le Grand Passage est l’expérience de la Mort-Renaissance psychique. Elle représente la dissolution radicale d’une structure de l’ego, d’une croyance ou d’un rôle social, qui est devenue trop rigide. Le processus est nécessaire pour atteindre un niveau d’intégration supérieur de la conscience. Le message est: faites confiance au chaos, il contient la semence de la forme la plus évoluée de vous-même."
      ]
    },
    {
      "subtitle": "Correspondances énergétiques :",
      "paragraphs": [],
      "correspondances": {
        "Éléments": "Feu / Éther, la purification et la dissolution",
        "Polarité": "Masculine (active dans l’acte de libération)",
        "En résonance": "Terre (La Cendre Fertile), Vie (La Métamorphose), Fleur d’ÅmÔurs (Agapè)"
      }
    },
    {
      "subtitle": "Question Racine :",
      "paragraphs": [
        "« Qu’est-ce qui doit mourir symboliquement aujourd’hui pour que je puisse vivre pleinement ? »"
      ]
    }
  ]
}