{
  "name": "L’EAU",
  "slug": "l_eau",
  "info": [
    "Évoque l’émotion et la fluidité. Symbolise les sentiments, l’intuition, l’inconscient et la capacité d’adaptation. Cette carte représente la sensibilité, l’empathie, la guérison et les profondeurs mystérieuses de l’âme."
  ],
  "sections": [
    {
      "subtitle": "Description étendue :",
      "paragraphs": [
        "La matrice du vivant et la sagesse de l’émotion. L’Eau est le premier berceau de la vie.",
        "C’est la matrice de la naissance, le miroir de l’âme, la gardienne de la mémoire universelle.",
        "Dans le tarot, elle symbolise la sensibilité, l’intuition, la réceptivité, la capacité d’accueillir et de transformer.",
        "Elle enseigne la force du lâcher-prise, la guérison par l’écoute, le mouvement souple et sincère du cœur.",
        "L’Eau n’a pas de forme, mais elle façonne tout."
      ]
    },
    {
      "subtitle": "Mots-clés lumière :",
      "paragraphs": [
        "Intuition, sensibilité, fluidité, guérison, compassion, écoute, mémoire, adaptation, douceur, connexion émotionnelle."
      ]
    },
    {
      "subtitle": "Ombre :",
      "paragraphs": [
        "Le débordement ou la noyade émotionnelle. Sous son ombre, L’Eau devient torrent ou stagnation.",
        "C’est la carte du déséquilibre émotionnel, de la confusion, des pleurs sans fin ou de l’attachement excessif.",
        "Elle avertit, l’émotion n’est pas l’ennemie mais elle doit circuler. L’eau qui ne bouge plus se trouble ; celle qui déborde détruit.",
        "Le juste mouvement, c’est celui qui reflète sans engloutir."
      ]
    },
    {
      "subtitle": "Mots-clés ombre :",
      "paragraphs": [
        "Mélancolie, dépendance affective, peur du changement, confusion, passivité, débordement émotionnel, stagnation."
      ]
    },
    {
      "subtitle": "Chemins d’intégration :",
      "paragraphs": [
        "Laisser les émotions se vivre et se libérer sans jugement.",
        "Purifier par les larmes, le mouvement ou le silence.",
        "Observer les reflets du monde intérieur sans s’y identifier.",
        "Se souvenir que la fluidité est une forme de force.",
        "Dans un tirage, L’Eau annonce une période de sensibilité accrue, une guérison, ou un retour à la réceptivité intuitive.",
        "Elle peut aussi signifier la nécessité d’écouter les émotions plutôt que de les fuir."
      ]
    },
    {
      "subtitle": "Exercice / Méditation :",
      "paragraphs": [
        "Assieds-toi près d’une source, d’une rivière ou imagine une mer calme.",
        "Respire en rythme avec les vagues : inspire quand elles montent, expire quand elles redescendent.",
        "Ressens ta propre marée intérieure.",
        "Laisse tout ce qui était figé reprendre son mouvement naturel. L’Eau est le langage de l’âme.",
        "Elle enseigne que la vulnérabilité est une forme de courage, et que la douceur est la force la plus ancienne du monde.",
        "Dans le grand Tarot Fleur d’ÅmÔurs, elle représente la mémoire vivante de la création, la compassion en mouvement, la capacité d’aimer sans retenir.",
        "Elle nous rappelle que tout ce qui résiste se dessèche, et que tout ce qui s’abandonne revient à la source.",
        "Rien ne peut blesser l’eau : elle s’adapte, elle apprend, elle se souvient."
      ]
    },
    {
      "subtitle": "Correspondances énergétiques :",
      "paragraphs": [],
      "correspondances": {
        "Élément": "Eau",
        "Polarité": "Féminine réceptive (sensible, matricielle, transformatrice)",
        "Correspondances symboliques": "Émotion, Intuition, Mémoire, Purification",
        "En résonance": "Vie (La Mémoire de la Sève), Air (L’Écho), Eau (L’Estuaire), Éther (L’Invisible)"
      }
    },
    {
      "subtitle": "Question Racine :",
      "paragraphs": [
        "«Quelle émotion suis-je en train de refouler qui demande à couler ?»"
      ]
    }
  ]
}