{
  "name": "STORGÈ",
  "slug": "storge",
  "info": [
    "Représente l’amour familial et l’affection naturelle. C’est l’amour des parents pour leurs enfants, la tendresse entre frères et sœurs et les liens du sang. Cette carte symbolise la sécurité du foyer, la loyauté tribale et l’amour qui naît de la proximité quotidienne."
  ],
  "sections": [
    {
      "subtitle": "Description étendue",
      "paragraphs": [
        "La tendresse enracinée",
        "Storgè est la force douce du lien du clan et du soin, l’amour qui nourrit, protège et enveloppe. C’est la mère, le père, l’enfant, la fratrie, la tribu, la mémoire du clan.",
        "Dans le tarot, elle représente la racine du cœur, la sève originelle qui relie chaque être à la lignée de la vie.",
        "Elle est l’amour du vivant sous sa forme la plus terrestre : celle qui réchauffe, qui répare, qui veille.",
        "C’est l’instinct du soin, la fidélité tranquille à ceux que l’on aime, même en silence.",
        "Tirer Storgè, c’est être invité à honorer les liens d’appartenance, à reconnaître ce qui nous a nourri, et à prolonger cet amour par nos gestes."
      ]
    },
    {
      "subtitle": "Mots-clés lumière :",
      "paragraphs": [
        "Soutien, sécurité, protection, stabilité, fidélité, compassion incarnée, continuité, mémoire affective."
      ]
    },
    {
      "subtitle": "Ombre :",
      "paragraphs": [
        "L’attachement qui enferme",
        "L’amour de Storgè peut devenir une prison lorsque la tendresse se change en contrôle, ou que la loyauté devient dépendance.",
        "L’attachement au passé peut bloquer l’élan du présent.",
        "La peur de perdre ou de décevoir crée alors des liens de devoir plus que d’amour.",
        "Dans cette ombre, Storgè rappelle que protéger ne veut pas dire posséder, et que nourrir l’autre exige aussi de le laisser partir.",
        "Elle nous enseigne à aimer sans retenir, à bénir sans enfermer."
      ]
    },
    {
      "subtitle": "Mots-clés ombre :",
      "paragraphs": [
        "Possession, étouffement, culpabilité, repli familial, peur de l’autonomie, nostalgie du passé, rigidité des rôles."
      ]
    },
    {
      "subtitle": "Chemins d’intégration :",
      "paragraphs": [
        "Réconcilier amour et liberté.",
        "Guérir les blessures de la lignée sans rejeter ses racines.",
        "Cultiver le soin comme acte de force, non de dépendance.",
        "Retrouver la douceur du foyer intérieur, celui qu’on porte en soi.",
        "Dans un tirage, Storgè vient rappeler la valeur du lien simple et loyal, et parfois la nécessité de relâcher la prise."
      ]
    },
    {
      "subtitle": "Exercice / Méditation :",
      "paragraphs": [
        "Ferme les yeux.",
        "Imagine tes ancêtres ou tes proches comme un cercle autour de toi. Sens leur bienveillance, puis rends-leur cet amour.",
        "Respire dans la gratitude, jusqu’à ressentir le calme d’une maison intérieure.",
        "Storgè est l’amour des racines vivantes, celui qui relie les générations et soutient la croissance.",
        "Elle parle du soin comme langage universel, de la mémoire comme sève.",
        "Dans le grand cycle du Tarot Fleur d’ÅmÔurs, elle est le terreau du sentiment, la fidélité du vivant à lui-même.",
        "Elle enseigne que l’amour véritable n’a pas besoin de promesse : il se transmet par la chaleur d’un geste, par la présence silencieuse, par le simple fait d’être là."
      ]
    }
  ]
}